{
  "schema_version": "harness.project-pack.v1",
  "id": "korean-natural-writing",
  "description": "Narrow distribution pack for Korean natural writing, advisory signal analysis, deterministic character counts, executable evals, shared terminology, and registry entry.",
  "paths": [
    ".claude/project-packs/korean-natural-writing/pack.json",
    ".claude/skills/korean-natural-writing",
    ".claude/skills/🇰🇷 k-skill/korean-character-count",
    ".claude/evals/korean-natural-writing",
    ".claude/evals/korean-character-count",
    ".claude/rules/common/agent-orchestration.md",
    ".claude/rules/common/korean-writing-style.md",
    ".claude/registry/skills/core.json"
  ],
  "links": {
    ".agents/skills": "../.claude/skills"
  },
  "exclude": [
    "**/.git/**",
    "**/__pycache__/**",
    "**/*.pyc",
    ".claude/settings*.json",
    ".mcp.json",
    ".env*"
  ]
}
